{
  "schema_version": "1.0.0",
  "credential_id": "10000000-0000-4000-8000-000000000001",
  "credential_version": 1,
  "credential": "wto_ac_1.10000000-0000-4000-8000-000000000001.AAAAAAAAAAAAAAAAAAAAAAAAAAAAAAAAAAAAAAAAAAA",
  "issued_at": "2026-07-12T12:00:00Z",
  "expires_at": "2026-10-10T12:00:00Z",
  "state": "active"
}
